DEVICE ID 1a86:7523 on Bus 003 Address 006 =================
 bLength                :   0x12 (18 bytes)
 bDescriptorType        :    0x1 Device
 bcdUSB                 :  0x110 USB 1.1
 bDeviceClass           :   0xff Vendor-specific
 bDeviceSubClass        :    0x0
 bDeviceProtocol        :    0x0
 bMaxPacketSize0        :    0x8 (8 bytes)
 idVendor               : 0x1a86
 idProduct              : 0x7523
 bcdDevice              :  0x262 Device 2.62
 iManufacturer          :    0x0 
 iProduct               :    0x2 Error Accessing String
 iSerialNumber          :    0x0 
 bNumConfigurations     :    0x1
  CONFIGURATION 1: 98 mA ===================================
   bLength              :    0x9 (9 bytes)
   bDescriptorType      :    0x2 Configuration
   wTotalLength         :   0x27 (39 bytes)
   bNumInterfaces       :    0x1
   bConfigurationValue  :    0x1
   iConfiguration       :    0x0 
   bmAttributes         :   0x80 Bus Powered
   bMaxPower            :   0x31 (98 mA)
    INTERFACE 0: Vendor Specific ===========================
     bLength            :    0x9 (9 bytes)
     bDescriptorType    :    0x4 Interface
     bInterfaceNumber   :    0x0
     bAlternateSetting  :    0x0
     bNumEndpoints      :    0x3
     bInterfaceClass    :   0xff Vendor Specific
     bInterfaceSubClass :    0x1
     bInterfaceProtocol :    0x2
     iInterface         :    0x0 
      ENDPOINT 0x82: Bulk IN ===============================
       bLength          :    0x7 (7 bytes)
       bDescriptorType  :    0x5 Endpoint
       bEndpointAddress :   0x82 IN
       bmAttributes     :    0x2 Bulk
       wMaxPacketSize   :   0x20 (32 bytes)
       bInterval        :    0x0
      ENDPOINT 0x2: Bulk OUT ===============================
       bLength          :    0x7 (7 bytes)
       bDescriptorType  :    0x5 Endpoint
       bEndpointAddress :    0x2 OUT
       bmAttributes     :    0x2 Bulk
       wMaxPacketSize   :   0x20 (32 bytes)
       bInterval        :    0x0
      ENDPOINT 0x81: Interrupt IN ==========================
       bLength          :    0x7 (7 bytes)
       bDescriptorType  :    0x5 Endpoint
       bEndpointAddress :   0x81 IN
       bmAttributes     :    0x3 Interrupt
       wMaxPacketSize   :    0x8 (8 bytes)
       bInterval        :    0x1